book_number,chapter_number_from,verse_number_from,chapter_number_to,verse_number_to,marker,text
24,10,19,0,0, [14],"Oder: Dies ist meine Krankheit, ich muss sie ertragen."
24,11,15,0,0, [15],"Oder: Nur dann hättet ihr Grund, euch zu freuen!"
24,12,9,0,0, [16],"Oder nach der griechischen Übersetzung: wie eine Hyänenhöhle, über der."
24,13,4,0,0, [17],Oder: nach Para (ein Ort in der Nähe von Jeremias Heimatstadt Anatot).
24,14,18,0,0, [18],Oder: Die Priester und Propheten ziehen durchs Land und wissen selbst keinen Rat.
24,15,12,0,0, [19],"Wörtlich: Kann man Eisen durchbrechen, Eisen aus dem Norden, oder Bronze?"
24,17,1,0,0, [20],"Wörtlich: Hörner. – Diese ragten an den vier oberen Ecken der Altäre hervor und wurden mit dem Blut der Opfertiere bestrichen, um ihn von der Sünde zu reinigen. – Vgl. <a href='B:30 16:18-19'>3. Mose  16,18-19</a>."
24,17,3,0,0, [21],"So nach einigen alten Übersetzungen. Der hebräische Text lautet: Unter den dicht belaubten Bäumen und auf den hohen Hügeln habt ihr sie aufgestellt. Meinen Berg im Land, euren Besitz und eure Schätze gebe ich der Plünderung preis."
24,17,11,0,0, [22],Wörtlich: Rebhuhn.
24,17,19,0,0, [23],Möglicherweise ist das Haupttor von Jerusalem gemeint. Ein Tor dieses Namens wird sonst nirgendwo in der Bibel erwähnt.
24,18,18,0,0, [24],Oder: mit unseren Worten.
24,21,14,0,0, [25],"Wörtlich: an euren Wald. – Gemeint sind wohl die Zedernsäulen und -balken der Paläste. Vgl. Kapitel <a href='B:300 22:6'>22,6</a>."
24,22,10,0,0, [26],Wörtlich: Beweint nicht den Toten.
24,22,10,0,0, [27],"Josias Sohn, sonst »Joahas« genannt. Vgl. <a href='B:140 36:1-4'>2. Chronik  36,1-4</a>."
24,22,18,0,0, [28],"Wörtlich: Ach, Bruder! Ach, Schwester!"
24,22,24,0,0, [29],Wörtlich: Konja. – Dies ist eine Kurzform von Jechonja und gleichbedeutend mit Jojachin. So auch in Vers 28.
24,23,5,0,0, [30],"Wörtlich: da werde ich für David einen gerechten Spross erwecken. – Gemeint ist der Messias. Vgl. Kapitel <a href='B:300 33:15'>33,15</a>; <a href='B:290 4:2'>Jesaja  4,2</a>; <a href='B:450 3:8'>Sacharja  3,8</a>."
24,23,15,0,0, [31],Wörtlich: Wermut.
24,23,18,0,0, [32],Oder: hat je in meiner (himmlischen) Ratsversammlung gestanden. – So auch in Vers 22.
24,23,33,0,0, [33],"Im Hebräischen gibt es ein Wort für »Last«, das zugleich »prophetische Botschaft« bedeuten kann."
24,23,39,0,0, [34],Oder: dann will ich euch vergessen.
24,24,1,0,0, [35],"Wörtlich: Jechonja. – Vgl. die Anmerkung zu Kapitel <a href='B:300 22:24'>22,24</a>."
24,25,26,0,0, [36],"Verschlüsselter Name für Babylon. Bei diesem Code wird der erste Buchstabe des hebräischen Alphabets durch den letzten ersetzt, der zweite durch den vorletzten usw."
24,26,18,0,0, [37],"<a href='B:400 3:12'>Micha  3,12</a>"
24,27,1,0,0, [38],So nach einigen hebräischen Handschriften und alten Übersetzungen. Im hebräischen Text steht der Name Jojakim.
24,27,20,0,0, [39],"Wörtlich: Jechonja. – Vgl. die Anmerkung zu Kapitel <a href='B:300 22:24'>22,24</a>."
24,28,4,0,0, [40],"Wörtlich: Jechonja. – Vgl. die Anmerkung zu Kapitel <a href='B:300 22:24'>22,24</a>."
24,29,2,0,0, [41],"Wörtlich: Jechonja. – Vgl. die Anmerkung zu Kapitel <a href='B:300 22:24'>22,24</a>."
24,31,7,0,0, [42],"So nach der griechischen Übersetzung. Der hebräische Text lautet: HERR, befreie dein Volk! Rette alle, die von Israel übrig geblieben sind!"
24,31,15,0,0, [43],"Rahel, die Mutter von Josef und Benjamin, war in Rama begraben. Hier steht sie bildhaft für die Stämme des Nordreichs."
24,31,22,0,0, [44],Wörtlich: Die Frau wird den Mann umgeben. – Der hebräische Text ist nicht sicher zu deuten.
24,31,26,0,0, [45],"Der Vers ist nicht sicher zu deuten. Vielleicht sind das Jeremias Worte, nachdem er die Vision aus den Versen <a href='B:300 31:23-25'>23-25</a> im Traum erhalten hat."
24,32,41,0,0, [46],"Wörtlich: einpflanze. – Vgl. Kapitel <a href='B:300 24:6'>24,6</a>; <a href='B:300 31:28'>31,28</a>; <a href='B:300 42:10'>42,10</a>."
24,33,2,0,0, [47],"Oder: der die Erde geschaffen hat, der sie formte und ihr Bestand gab."
24,33,15,0,0, [48],Wörtlich: werde ich einen Spross der Gerechtigkeit aufsprossen lassen.
24,37,1,0,0, [49],"Wörtlich: Konja. – Vgl. die Anmerkung zu Kapitel <a href='B:300 22:24'>22,24</a>."
24,41,9,0,0, [50],"So nach der griechischen Übersetzung. Der hebräische Text lautet: Die Zisterne, in die Jismael die Leichen werfen ließ, die er zusammen mit (oder: wegen) Gedalja ermordet hatte, hatte König Asa von Juda seinerzeit anlegen lassen."
24,42,1,0,0, [51],"Oder nach der griechischen Übersetzung: Asarja. – Vgl. Kapitel <a href='B:300 43:2'>43,2</a>."
24,43,12,0,0, [52],So nach der griechischen Übersetzung. Der hebräische Text lautet: Ich werde.
24,43,12,0,0, [53],"In Heliopolis (»Sonnenstadt«) stand der Tempel des Sonnengottes Re, der für seine Obelisken berühmt war."
24,44,17,0,0, [54],"Vgl. die Anmerkung zu Kapitel <a href='B:300 7:18'>7,18</a>."
24,47,5,0,0, [55],So nach der griechischen Übersetzung. Der hebräische Text lautet: ihr restlichen Bewohner der Talebene.
24,48,6,0,0, [56],Wörtlich: Werdet wie ein Dornstrauch in der Wüste!
24,48,9,0,0, [57],"Oder nach der griechischen Übersetzung: Setzt den Moabitern einen Grabstein, denn es ist aus mit ihnen. – Der hebräische Text ist nicht sicher zu deuten."
24,48,25,0,0, [58],"Wörtlich: Das Horn Moabs ist abgehauen, und sein Arm ist zerschmettert! – Das Horn und der Arm stehen sinnbildlich für Stärke und Kraft."
24,49,1,0,0, [59],So nach einigen alten Übersetzungen. Der hebräische Text lautet: ihr König.
24,49,16,0,0, [60],"Das hebräische Wort für Fels (»Sela«) ist zugleich der Name von Edoms Hauptstadt, die schwer zugänglich im Gebirge lag."
24,50,2,0,0, [61],Bel ist ein späterer Titel für die babylonische Hauptgottheit Marduk. Beide Namen bezeichnen hier also ein und denselben Gott.
24,50,11,0,0, [62],So nach der griechischen Übersetzung. Der hebräische Text lautet: wie eine dreschende Kuh.
24,50,21,0,0, [63],"Meratajim (»unbeugsamer Trotz«) und Pekod (»Strafe«) sind zwei Gebiete in Babylonien, die hier bildhaft für das ganze Land stehen."
24,51,1,0,0, [64],Oder: Geist.
24,51,1,0,0, [65],"Wörtlich: und über die, welche im Herzen meiner Widersacher wohnen. – Ein verschlüsselter Name für die Babylonier."
24,51,5,0,0, [66],Oder: obwohl auf ihrem Land eine schwere Schuld lastet.
24,51,41,0,0, [67],"Verschlüsselter Name für Babylon. Vgl. die Anmerkung zu Kapitel <a href='B:300 25:26'>25,26</a>."
24,51,44,0,0, [68],"Vgl. die Anmerkung zu Kapitel <a href='B:300 50:2'>50,2</a>."
25,1,1,0,0, [1],Die ersten vier Kapitel dieses Buches sind alphabetisch angeordnet: Im Hebräischen fängt jeder Vers (bzw. in Kapitel 3 jeder dritte Vers) mit dem jeweils nächsten Buchstaben des Alphabets an.
25,2,3,0,0, [2],Wörtlich: Er hat jedes Horn Israels abgehauen. – Das Horn steht sinnbildlich für Stärke und Kraft. So auch in Vers 17.
25,2,17,0,0, [3],Wörtlich: er hat das Horn deiner Gegner erhöht.
25,3,22,0,0, [4],So nach einigen hebräischen Handschriften und alten Übersetzungen. Der hebräische Text lautet: Durch die Güte des HERRN sind wir noch nicht am Ende.
25,3,24,0,0, [5],Wörtlich: der HERR ist mein Erbteil.
25,4,3,0,0, [6],"Die Straußenhennen galten als schlechte Mütter, da sie das Nest verließen, um die Eier in der Sonne brüten zu lassen. Vgl. <a href='B:220 39:13-17'>Hiob  39,13-17</a>."
25,4,7,0,0, [7],"Wörtlich: Ihre Fürsten waren reiner als Schnee, weißer als Milch, ihr Leib röter als Korallen, ihre Gestalt wie Saphir."
25,5,16,0,0, [8],Wörtlich: Die Krone ist uns vom Kopf gefallen.
26,1,1,0,0, [1],Das »30. Jahr« bezieht sich vermutlich auf Hesekiels Alter.
26,1,2,0,0, [2],"Wörtlich: kam die Hand des HERRN über ihn. – Die Hand ist hier ein Symbol für Gottes Wirken und Macht. Mit dieser Wendung wird im Buch Hesekiel häufig eine Vision oder Botschaft Gottes an den Propheten eingeleitet. Vgl. Kapitel <a href='B:330 3:14'>3,14</a>.<a href='B:330 3:22'>22</a>; <a href='B:330 8:1'>8,1</a>; <a href='B:330 37:1'>37,1</a>; <a href='B:330 40:1'>40,1</a>."
26,1,20,0,0, [3],Wörtlich: denn der Geist des lebendigen Wesens war in den Rädern. – Der hebräische Text ist nicht sicher zu deuten.
26,3,12,0,0, [4],"Oder: eine laute, gewaltige Stimme, während sich die Herrlichkeit des HERRN von ihrer Stätte erhob."
26,3,14,0,0, [5],"Wörtlich: die Hand des HERRN. – Vgl. Kapitel <a href='B:330 1:3'>1,3</a>."
26,6,9,0,0, [6],"Oder: Ihr werdet begreifen, wie sehr es mir das Herz brach, dass ihr."
26,7,23,0,0, [7],So nach der griechischen Übersetzung. Der hebräische Text lautet: Fertige die Kette an! Denn.
26,8,14,0,0, [8],"Ein mesopotamischer Fruchtbarkeitsgott. Seine Anhänger glaubten, dass sein jährliches Sterben und Auferstehen sich in der Natur widerspiegele."
26,8,17,0,0, [9],"Auf welches Ritual hier angespielt wird, lässt sich nicht mit Sicherheit sagen."
26,9,3,0,0, [10],"Gemeint sind die vier geflügelten Gestalten, die Hesekiel schon in einer früheren Vision gesehen hatte. Vgl. Kapitel 1."
26,9,4,0,0, [11],"Im Hebräischen steht hier der Buchstabe Tav, der in der althebräischen Schrift aussah wie ein Kreuz."
26,10,12,0,0, [12],Das hebräische Wort kann auch »Räderwerk« bedeuten.
26,11,15,0,0, [13],Wörtlich: Sie sind fern vom HERRN.
26,11,16,0,0, [14],Oder: bin ihnen ein wenig.
26,12,10,0,0, [15],Wörtlich: dem Fürsten. – Gemeint ist König Zedekia. So auch in Vers 12.
26,12,12,0,0, [16],"Oder: damit er das Land, das er verlässt, nicht mehr sieht."
26,12,13,0,0, [17],Denn Zedekia wurden die Augen ausgestochen.
26,18,6,0,0, [18],"In dieser Zeit galt eine Frau wegen ihrer Blutung als unrein. Vgl. <a href='B:30 15:19'>3. Mose  15,19</a>. Vgl. »rein/unrein« in den Sacherklärungen."
26,19,7,0,0, [19],Wörtlich: seine Witwen. – Der hebräische Text ist nicht sicher zu deuten.
26,19,10,0,0, [20],Wörtlich: wie ein Weinstock in deinem Blut. – Der hebräische Text ist nicht sicher zu deuten.
26,20,12,0,0, [21],"Wörtlich: meine Sabbate. – Gemeint sind hier und im Rest des Kapitels evtl. auch die besonderen Feiertage, an denen keine Arbeit verrichtet werden durfte, sowie das landwirtschaftliche Ruhejahr."
26,20,29,0,0, [22],"Das hebräische Wort für »Opferstätte« (bama) wird hier durch ein Wortspiel erklärt, das im Deutschen nicht wiederzugeben ist."
26,21,7,0,0, [23],Oder: den Heiligtümern.
26,21,15,0,0, [24],Der Satz ist im hebräischen Text nicht sicher zu deuten. Ebenso in Vers 18.
26,21,26,0,0, [25],"Es war im alten Orient üblich, Pfeile als Lose zu benutzen. In diesem Fall trugen sie anscheinend die Aufschrift der beiden Städte Rabba und Jerusalem oder fielen in die entsprechende Richtung."
26,21,32,0,0, [26],"Oder: Es wird nicht eher wieder aufgebaut, bis der kommt, dem diese Stadt rechtmäßig gehört. Ihm werde ich sie geben."
26,22,8,0,0, [27],"Wörtlich: meine Sabbate. – Vgl. die Anmerkung zu Kapitel <a href='B:330 20:12'>20,12</a>. So auch in Vers 26."
26,22,10,0,0, [28],"Vgl. die Anmerkung zu Kapitel <a href='B:330 18:6'>18,6</a>."
26,22,25,0,0, [29],So nach der griechischen Übersetzung. Der hebräische Text lautet: Die Verschwörung der Propheten.
26,23,5,0,0, [30],Oder: benachbarten. – Die Bedeutung des hebräischen Wortes ist unsicher. Ebenso in Vers 12.
26,23,38,0,0, [31],"Wörtlich: meine Sabbate. – Vgl. die Anmerkung zu Kapitel <a href='B:330 20:12'>20,12</a>."
26,23,43,0,0, [32],Die Verse <a href='B:330 23:42'>42</a> und 43 sind nicht sicher zu deuten.
26,24,1,0,0, [33],"Oder: der Regierung Zedekias. – Der Bezugspunkt der Datierung ist nicht ganz sicher. Vgl. <a href='B:120 25:1'>2. Könige  25,1</a>."
26,24,10,0,0, [34],So nach der griechischen Übersetzung. Der hebräische Text ist nicht sicher zu deuten.
26,24,12,0,0, [35],"Oder: Der Rost geht einfach nicht ab, darum werft ihn ins Feuer!"
26,26,1,0,0, [36],Die Monatsangabe fehlt hier.
26,26,20,0,0, [37],So nach der griechischen Übersetzung. Der hebräische Text ist nicht sicher zu deuten.
26,27,5,0,0, [38],"Anderer Name für den Berg Hermon. Vgl. <a href='B:50 3:9'>5. Mose  3,9</a>."
26,27,15,0,0, [39],So nach der griechischen Übersetzung. Der hebräische Text lautet: Dedan.
26,27,16,0,0, [40],Oder: Edomiter. – Aram (= Syrien) und Edom sind in der hebräischen Schrift leicht zu verwechseln.
26,27,17,0,0, [41],"Dieser Ort wird in <a href='B:70 11:33'>Richter  11,33</a> erwähnt. Der hebräische Text ist nicht sicher zu deuten."
26,27,17,0,0, [42],"Oder: Feigen, Konfekt. – Die Bedeutung des hebräischen Wortes ist unsicher."
26,27,24,0,0, [43],Nicht alle in den Versen <a href='B:330 27:12-24'>12-24</a> genannten Waren und Orte sind eindeutig zu bestimmen.
26,27,25,0,0, [44],"Wörtlich: Tarsis-Schiffe. – So wurden große Handelsschiffe bezeichnet, die in der Lage waren, die weite Strecke bis nach Tarsis (im heutigen Spanien) zu segeln."
26,28,12,0,0, [45],Wörtlich: das Siegel.
26,28,13,0,0, [46],Der hebräische Text ist nicht sicher zu deuten.
26,28,14,0,0, [47],Oder: du warst ein Kerub mit ausgebreiteten Flügeln.
26,28,16,0,0, [48],"Oder: und ich stieß dich, du Kerub."
26,29,3,0,0, [49],"Das hebräische Wort kann allgemein ein großes Wassertier bezeichnen, aber auch »Ungeheuer« oder »Drache« bedeuten."
26,29,7,0,0, [50],So nach den alten Übersetzungen. Der hebräische Text lautet: lässt ihre Hüften fest stehen.
26,29,21,0,0, [51],"Wörtlich: werde ich dem Haus Israel ein Horn wachsen lassen. – Das Horn steht sinnbildlich für Stärke und Kraft, vielleicht auch in der Person eines künftigen Herrschers."
26,30,5,0,0, [52],Wörtlich: die Söhne aus dem Land des Bundes. – Evtl. ist hiermit auch ein anderer Verbündeter Ägyptens gemeint.
26,30,17,0,0, [53],"Der hebräische Name der Stadt lautet On. Stattdessen steht hier Awen (»Nichtiges«), eine Anspielung auf den in On befindlichen Tempel des ägyptischen Sonnengottes."
26,32,2,0,0, [54],"Vgl. die Anmerkung zu Kapitel <a href='B:330 29:3'>29,3</a>."
26,32,17,0,0, [55],Die Monatsangabe fehlt hier. Gemeint ist wahrscheinlich der 12. Monat wie in Vers <a href='B:330 32:1'>1</a>.
26,32,27,0,0, [56],So nach der griechischen Übersetzung. Der hebräische Text lautet: wie die Helden getrennt von den Unbeschnittenen.
26,33,22,0,0, [57],"Nach Kapitel <a href='B:330 3:26'>3,26</a> hatte Gott den Propheten vorübergehend stumm werden lassen."
26,33,31,0,0, [58],Der hebräische Text ist nicht sicher zu deuten.
26,34,16,0,0, [59],So nach der griechischen Übersetzung. Der hebräische Text lautet: rotte ich aus.
26,36,15,0,0, [60],Oder: deine Bewohner zu Fall bringen.
26,36,17,0,0, [61],"Vgl. die Anmerkung zu Kapitel <a href='B:330 18:6'>18,6</a>."
26,37,16,0,0, [62],"Wörtlich: Josef, das Holz Ephraims. – Josef war der Vater von Ephraim und Manasse. Vgl. <a href='B:10 46:19'>1. Mose  46,19</a>."
26,37,19,0,0, [63],Wörtlich: das Holz Josefs.
26,37,23,0,0, [64],So nach vielen alten Handschriften. Der hebräische Text lautet: aus ihren Wohnsitzen.
26,38,2,0,0, [65],"Wer hiermit gemeint ist, lässt sich nicht mit Sicherheit sagen. Im Neuen Testament stehen Gog und Magog sinnbildlich für die feindlichen Mächte, die in der Endzeit gegen Gottes Volk kämpfen werden. Vgl. <a href='B:730 20:8'>Offenbarung  20,8</a>."
26,38,12,0,0, [66],Wörtlich: am Nabel/Mittelpunkt der Welt.
26,38,13,0,0, [67],Im Hebräischen steht noch: und all ihre jungen Löwen. – Der Text ist nicht sicher zu deuten.
26,39,11,0,0, [68],Oder: östlich vom Mittelmeer. – Die Ortsangabe ist im hebräischen Text nicht sicher zu deuten.
26,40,5,0,0, [69],"Wörtlich: von 6 Ellen, jede Elle so lang wie eine gewöhnliche Elle und eine Handbreit. – Die Großelle war etwa 52 Zentimeter lang, die Messlatte entsprechend etwa <a href='B:330 3:12'>3,12</a> Meter. Die Maße werden im Folgenden gerundet angegeben, weil im Text das Verhältnis der einzelnen Maßangaben zueinander im Vordergrund steht."
26,40,14,0,0, [70],So in Anlehnung an die griechische Übersetzung. Der hebräische Text ist nicht sicher zu deuten.
26,40,29,0,0, [71],"So nach der griechischen Übersetzung. Im hebräischen Text steht noch: Ringsum gab es Vorhallen, die 25 Ellen (<a href='B:330 12:5'>12,5</a> Meter) lang und 5 Ellen (<a href='B:330 2:5'>2,5</a> Meter) breit waren."
26,40,38,0,0, [72],Evtl. gilt dies auch für die anderen Tore des inneren Vorhofs. Der hebräische Text ist nicht klar zu deuten.
26,40,38,0,0, [73],"Wörtlich: Dort spülte man das Brandopfer ab. – Vgl. <a href='B:30 1:9'>3. Mose  1,9</a>.<a href='B:30 1:13'>13</a>."
26,40,44,0,0, [74],So nach der griechischen Übersetzung. Der hebräische Text lautet: lagen Räume für die Sänger.
26,40,48,0,0, [75],"So nach der griechischen Übersetzung. Der hebräische Text lautet: Der Toreingang war auf beiden Seiten 3 Ellen (<a href='B:330 1:5'>1,5</a> Meter) breit."
26,40,49,0,0, [76],"So nach der griechischen Übersetzung. Der hebräische Text lautet: 11 Ellen (<a href='B:330 5:5'>5,5</a> Meter)."
26,40,49,0,0, [77],So nach der griechischen Übersetzung. Der hebräische Text lautet: Stufen führten zu ihr hinauf.
26,41,6,0,0, [78],Oder: insgesamt.
26,41,7,0,0, [79],Vers <a href='B:330 41:7'>7</a> ist nicht sicher zu deuten.
26,41,8,0,0, [80],Die Verse <a href='B:330 41:8-11'>8-11</a> sind nicht sicher zu deuten.
26,41,16,0,0, [81],Vers <a href='B:330 41:16'>16</a> ist nicht sicher zu deuten.
26,41,22,0,0, [82],So nach der griechischen Übersetzung. Im hebräischen Text fehlt die Angabe über die Breite.
26,41,22,0,0, [83],So nach der griechischen Übersetzung. Der hebräische Text lautet: seine Länge.
26,42,4,0,0, [84],Oder nach der griechischen Übersetzung: 50 Meter in der Länge.
26,42,10,0,0, [85],So nach der griechischen Übersetzung. Der hebräische Text lautet: An der Ostseite.
26,43,7,0,0, [86],"Oder: verehren. – Dann wären nicht die Grabstätten an sich gemeint, sondern ein Totenkult, der für die Könige beim Tempel betrieben wurde."
26,43,8,0,0, [87],"Oder: Grab-/Gedenkstätten, Götzentempel."
26,43,17,0,0, [88],Die Beschreibung des Altars ist nicht in allen Einzelheiten sicher zu deuten.
26,44,19,0,0, [89],"Schließlich kann unbefugter Kontakt mit dem Heiligen tödlich sein. Vgl. <a href='B:40 4:15'>4. Mose  4,15</a>; <a href='B:100 6:6-7'>2. Samuel  6,6-7</a>."
26,44,24,0,0, [90],"Wörtlich: meine Sabbate. – Vgl. die Anmerkung zu Kapitel <a href='B:330 20:12'>20,12</a>."
26,45,1,0,0, [91],"So nach der griechischen Übersetzung. Der hebräische Text lautet: 10.000 Ellen (5 Kilometer). – So auch in Kapitel <a href='B:330 48:9'>48,9</a>."
26,45,5,0,0, [92],"So nach der griechischen Übersetzung. Der hebräische Text lautet: in Besitz nehmen, zwanzig Räume."
26,45,18,0,0, [93],"Wörtlich: sollst du. – Auf wen sich die Anweisung bezieht, lässt sich nicht mit Sicherheit sagen. So auch in Vers 20."
26,46,20,0,0, [94],"Vgl. die Anmerkung zu Kapitel <a href='B:330 44:19'>44,19</a>."
26,47,16,0,0, [95],"So nach der griechischen Übersetzung (vgl. Kapitel <a href='B:330 48:1'>48,1</a>). Der hebräische Text lautet: … über Zedad, Lebo, Hamat, Berota."
26,47,16,0,0, [96],So nach der griechischen Übersetzung (vgl. Vers 17). Der hebräische Text lautet: Hazar-Tikon.
26,47,18,0,0, [97],"So nach der griechischen Übersetzung. Der hebräische Text lautet: im Osten, das sollt ihr messen."
26,48,9,0,0, [98],"Vgl. Kapitel <a href='B:330 45:1'>45,1</a>."
27,1,2,0,0, [1],"Wörtlich: ins Land Schinar. – Schinar ist ein alter Name für Babylonien, die Ebene zwischen Euphrat und Tigris."
27,2,4,0,0, [2],"Ab hier bis Kapitel <a href='B:340 7:28'>7,28</a> ist der biblische Text auf Aramäisch, der damaligen Weltsprache, überliefert."
27,2,9,0,0, [3],Wörtlich: bis die Zeit sich ändert.
27,3,8,0,0, [4],Oder: Einige Chaldäer (d.h. Babylonier).
27,4,5,0,0, [5],Bel ist ein späterer Titel für die babylonische Hauptgottheit Marduk.
27,4,10,0,0, [6],Wörtlich: ein heiliger Wächter. – So auch in Vers 20.
27,4,12,0,0, [7],Wörtlich: Er soll. – So auch in Vers 20.
27,4,13,0,0, [8],"Gemeint sind wohl Jahre. So auch in den Versen 20, 22 und 29."
27,4,14,0,0, [9],Wörtlich: Wächter.
27,5,1,0,0, [10],"Seit der Regierungszeit von König Nebukadnezar, von dem in den Kapiteln 1–4 die Rede war, waren etwa 25 Jahre vergangen."
27,5,2,0,0, [11],"Wörtlich: Vater. – So auch in den Versen <a href='B:340 11:13'>11, 13</a> und 18. Die historischen Einzelheiten sind unklar."
27,5,25,0,0, [12],"Wörtlich: Mene mene tekel u-parsin. – Diese aramäischen Worte waren für Belsazar zwar verständlich, aber in ihrer Bedeutung rätselhaft."
27,7,13,0,0, [13],Wörtlich: wie ein Menschensohn. – Vgl. »Menschensohn« in den Sacherklärungen.
27,7,22,0,0, [14],Oder: Er verschaffte dem heiligen Volk des höchsten Gottes Recht.
27,7,23,0,0, [15],Wörtlich: Er erklärte mir.
27,7,25,0,0, [16],"Ein »Zeitraum« ist hier wohl als ein Jahr zu verstehen, insgesamt also dreieinhalb Jahre. Vgl. Kapitel <a href='B:340 12:7'>12,7</a>."
27,8,12,0,0, [17],Der hebräische Text ist nicht sicher zu deuten.
27,8,14,0,0, [18],"Wörtlich: 2300 Abend-Morgen. – Es ist möglich, dass diese Angabe sich auf die täglichen Opfer bezieht, die morgens und abends dargebracht wurden. Dann könnte man auch übersetzen: nach 1150 Tagen. Ebenso in Vers 26."
27,9,1,0,0, [19],Nicht zu verwechseln mit dem persischen König Xerxes im Buch Esther.
27,9,2,0,0, [20],"Vgl. <a href='B:300 25:11'>Jeremia  25,11</a>; <a href='B:140 36:21'>2. Chronik  36,21</a>."
27,9,24,0,0, [21],Wörtlich: Siebzig Siebenheiten. – Eine »Siebenheit« (oder traditionell »Woche«) ist hier wohl als ein Zeitraum von sieben Jahren zu verstehen.
27,9,24,0,0, [22],Oder: und der Allerheiligste wird gesalbt. – Dann wäre hier der Messias gemeint.
27,9,25,0,0, [23],Oder: liegen sieben mal sieben Jahre und zweiundsechzig mal sieben Jahre. So lange werden.
27,9,26,0,0, [24],Wörtlich: und er wird nicht haben. – Der hebräische Text ist nicht sicher zu deuten.
27,10,6,0,0, [25],Wörtlich: wie ein Türkis.
27,11,5,0,0, [26],"Mit dem Südreich ist hier und im Folgenden Ägypten gemeint, das Nordreich bezeichnet Syrien."
27,11,7,0,0, [27],Wörtlich: ein Spross aus ihren Wurzeln.
27,11,10,0,0, [28],Oder: aufbieten. Einer (von ihnen) wird wie eine zerstörerische Flut.
27,11,22,0,0, [29],Wörtlich: den Fürst des Bundes. – Möglicherweise ist hier auch der Hohepriester gemeint.
27,11,37,0,0, [30],"Gemeint ist wahrscheinlich der Gott Tammus (vgl. <a href='B:330 8:14'>Hesekiel  8,14</a>)."
27,11,45,0,0, [31],Wörtlich: dem Berg der heiligen Zierde.
27,12,4,0,0, [32],Oder: Viele werden sich auf die Suche (nach der Wahrheit) machen.
27,12,7,0,0, [33],"Vgl. die Anmerkung zu Kapitel <a href='B:340 7:25'>7,25</a>."
28,1,4,0,0, [1],"Der Name Jesreel erinnert daran, unter welchen Umständen König Jehu an die Macht gekommen war. Vgl. <a href='B:120 9:1-10:1'>2. Könige  9-10</a>."
28,2,2,0,0, [2],Wörtlich: Groß ist der Tag von Jesreel. – Jesreel bedeutet »Gott sät«.
28,2,17,0,0, [3],"Vgl. <a href='B:60 7:1-26'>Josua  7,1-26</a>."
28,2,18,0,0, [4],"Hosea gebraucht hier ein Wortspiel: Baal (»Herr, Besitzer«) ist gleichzeitig der Name des kanaanitischen Hauptgottes und die übliche Bezeichnung für den Ehemann."
28,2,24,0,0, [5],"Wörtlich: Dann wird Jesreel. – Vgl. Kapitel <a href='B:350 1:4-5'>1,4-5</a> und <a href='B:350 2:2'>2,2</a>."
28,3,1,0,0, [6],"Andere beziehen die Verse <a href='B:350 3:1-3'>1-3</a> nicht auf Gomer, sondern auf eine andere Frau, die Hosea heiraten soll."
28,3,1,0,0, [7],Wörtlich: und Rosinenkuchen lieben. – Diese Kuchen aus gepressten Rosinen wurden auf Festen zu Ehren des Gottes Baal gereicht.
28,3,3,0,0, [8],Oder: Und auch ich werde dir treu sein.
28,4,7,0,0, [9],Oder: Sie haben die Herrlichkeit Gottes gegen schändliche Götzen getauscht.
28,4,8,0,0, [10],Wörtlich: Sie essen die Sünde meines Volkes und verlangen nach ihrer Schuld.
28,4,15,0,0, [11],Bet-Awen (»Haus des Unheils«) ist eine ironische Abänderung des Namens Bethel (»Haus Gottes«).
28,4,17,0,0, [12],Mit »Ephraim« meint Hosea stets das Nordreich Israel.
28,5,1,0,0, [13],Oder: Euch spreche ich nun das Urteil. – Evtl. spielt Hosea bewusst mit der Doppeldeutigkeit des hebräischen Wortes für Recht/Gericht.
28,5,2,0,0, [14],Oder: Ihr bringt die Menschen zu Fall wie eine tiefe Grube in Schittim. – Der hebräische Text ist nicht sicher zu deuten.
28,5,4,0,0, [15],Wörtlich: vom Geist der Hurerei.
28,5,7,0,0, [16],Oder: Darum werden ihre Neumondfeste sie vernichten.
28,6,5,0,0, [17],Wörtlich: mein Recht geht hervor wie das Licht.
28,6,7,0,0, [18],"Oder: so wie damals Adam. – Adam ist sowohl der Name des ersten Menschen (vgl. <a href='B:10 3:1'>1. Mose  3</a>) als auch einer Ortschaft im Jordantal (vgl. <a href='B:60 3:16'>Josua  3,16</a>)."
28,7,7,0,0, [19],Der hebräische Text in den Versen <a href='B:350 7:1-7'>1-7</a> ist nicht sicher zu deuten.
28,8,4,0,0, [20],Oder: und rennen somit selbst ins Verderben!
28,9,1,0,0, [21],Auf den Dreschplätzen wurden Erntefeste zu Ehren der anderen Götter gefeiert.
28,9,9,0,0, [22],"Vgl. <a href='B:70 19:22-30'>Richter  19,22-30</a>."
28,9,15,0,0, [23],Wörtlich: Haus.
28,10,9,0,0, [24],"Vgl. <a href='B:70 19:22-30'>Richter  19,22-30</a>."
28,10,11,0,0, [25],Wörtlich: Jakob. – Der Name von Israels Stammvater wird häufig auch für das Volk Israel gebraucht.
