book_number,chapter_number_from,verse_number_from,chapter_number_to,verse_number_to,marker,text
16,5,15,0,0, [5],So nach der lateinischen Übersetzung. Im hebräischen Text ist kein Zeitraum angegeben.
16,6,9,0,0, [6],Oder: Doch ich ging umso entschlossener ans Werk.
16,7,43,0,0, [7],"So nach <a href='B:150 2:40'>Esra  2,40</a>. Der hebräische Text lautet: Jeschua (Nachkommen von Kadmiël und Hodawja)."
16,8,1,0,0, [8],"Dieser Versteil gehört nach der regulären Zählung noch zu Kapitel <a href='B:160 7:72'>7,72</a>."
16,8,18,0,0, [9],"Vgl. <a href='B:30 23:40-43'>3. Mose  23,40-43</a>."
16,9,15,0,0, [10],Gemeint ist das Manna. Vgl. »Manna« in den Sacherklärungen.
16,11,8,0,0, [11],So nach der griechischen Übersetzung. Der hebräische Text lautet: und nach ihm Gabbai und Sallai.
16,11,23,0,0, [12],"Wahrscheinlich ist hier der persische König gemeint und nicht König David, der seinerzeit die Dienste am Tempel ordnete. Vgl. <a href='B:130 25:1-31'>1. Chronik  25,1-31</a>."
16,12,11,0,0, [13],So nach Vers 22. Der hebräische Text lautet: Jonatan.
16,12,17,0,0, [14],Hier fehlt ein Name im hebräischen Text.
16,12,24,0,0, [15],"So nach Vers <a href='B:160 12:8'>8</a> und Kapitel <a href='B:160 9:4'>9,4</a>; <a href='B:160 10:10'>10,10</a>. Der hebräische Text lautet: Jeschua, der Sohn Kadmiëls."
17,2,6,0,0, [1],"Wörtlich: Jechonja. – Dies ist ein anderer Name für Jojachin. Vgl. <a href='B:120 24:6-16'>2. Könige  24,6-16</a>."
17,2,23,0,0, [2],Der hebräische Ausdruck könnte auch das Aufspießen oder Aufhängen an einem Holzpfahl (ähnlich der Kreuzigung) meinen. So auch im weiteren Verlauf des Buches.
17,3,7,0,0, [3],»auf den 13. Tag« ist nach der griechischen Übersetzung ergänzt. Vgl. auch Vers 13.
18,1,6,0,0, [1],Wörtlich: der Ankläger. – Vgl. »Satan« in den Sacherklärungen.
18,1,16,0,0, [2],Wörtlich: Das Feuer Gottes fiel vom Himmel und.
18,2,9,0,0, [3],Wörtlich: Hältst du immer noch an deiner Vollkommenheit fest?
18,3,8,0,0, [4],Bildhafte Redeweise für gottfeindliche Schicksalsmächte.
18,5,23,0,0, [5],Wörtlich: Dein Bund wird sein mit den Steinen auf dem Feld.
18,6,4,0,0, [6],Wörtlich: mein Geist trinkt ihr Gift.
18,6,14,0,0, [7],Der hebräische Text ist schwer zu deuten.
18,7,19,0,0, [8],"Wörtlich: Du lässt mich nicht einmal so lange in Ruhe, bis ich meinen Speichel heruntergeschluckt habe."
18,9,13,0,0, [9],Wörtlich: Rahab. – Vgl. »Rahab« in den Sacherklärungen.
18,9,33,0,0, [10],"Wörtlich: der seine Hand auf uns beide legt. – Wahrscheinlich eine symbolische Handlung, mit der ein Schiedsspruch verkündet wurde."
18,9,35,0,0, [11],So in Anlehnung an die griechische Übersetzung. Der hebräische Text ist nicht sicher zu deuten.
18,10,10,0,0, [12],Wörtlich: Hast du mich nicht wie Milch ausgegossen und wie Käse gerinnen lassen?
18,11,8,0,0, [13],Wörtlich: Was willst du tun?
18,13,27,0,0, [14],Wörtlich: und ritzt die Sohlen meiner Füße ein.
18,14,4,0,0, [15],Wörtlich: Wie könnte ein Reiner vom Unreinen kommen? Nicht einer! – Vgl. »rein/unrein« in den Sacherklärungen.
18,15,2,0,0, [16],Wörtlich: Darf ein Weiser mit windigem Wissen antworten und seinen Bauch mit Ostwind füllen?
18,15,19,0,0, [17],Wörtlich: kein Fremder war unter ihnen umhergezogen.
18,15,27,0,0, [18],Wörtlich: Er hat sein Gesicht mit Fett bedeckt und an den Hüften Fett angesetzt.
18,16,15,0,0, [19],Wörtlich: ich habe mein Horn in den Staub gesenkt. – Das Horn steht sinnbildlich für Stärke und Kraft.
18,19,22,0,0, [20],Wörtlich: Werdet ihr von meinem Fleisch nicht gesättigt?
18,19,25,0,0, [21],Wörtlich: er wird sich als Letzter über dem Staub erheben!
18,19,26,0,0, [22],"Oder: Wenn meine Haut so zerfressen ist, werde ich doch in meinem Leib Gott sehen!"
18,21,22,0,0, [23],Wörtlich: die Erhabenen.
18,24,20,0,0, [24],Wörtlich: der Mutterschoß vergisst ihn.
18,26,4,0,0, [25],Wörtlich: Wessen Geist ging aus von dir?
18,26,12,0,0, [26],Wörtlich: Rahab. – Vgl. »Rahab« in den Sacherklärungen.
18,27,18,0,0, [27],So nach der griechischen Übersetzung. Der hebräische Text lautet: Er hat sein Haus gebaut wie die Motte.
18,28,13,0,0, [28],So nach der griechischen Übersetzung. Der hebräische Text lautet: Kein Mensch kennt ihren Wert.
18,29,6,0,0, [29],"Wörtlich: Meine Schritte badeten sich in Dickmilch, und der Fels neben mir goss Öl aus."
18,29,18,0,0, [30],Wörtlich: In meinem Nest werde ich einmal sterben und meine Tage so zahlreich machen wie Sand am Meer.
18,29,20,0,0, [31],"Wörtlich: Meine Ehre wird bei mir frisch bleiben, und mein Bogen in meiner Hand wird sich verjüngen."
18,30,11,0,0, [32],Wörtlich: Gott hat die Sehne meines Bogens schlaff gemacht.
18,31,33,0,0, [33],Oder: wie Adam es tat. – Vgl. <a href='B:10 3:1'>1. Mose  3</a>.
18,35,10,0,0, [34],Wörtlich: der Loblieder gibt in der Nacht.
18,36,20,0,0, [35],Die Verse <a href='B:220 36:18-20'>18-20</a> sind nicht sicher zu deuten.
18,37,7,0,0, [36],Wörtlich: Auf die Hand jedes Menschen setzt er sein Siegel.
18,38,15,0,0, [37],Wörtlich: ihr Licht.
18,38,36,0,0, [38],Der hebräische Text in Vers <a href='B:220 38:36'>36</a> ist nicht sicher zu deuten.
18,38,37,0,0, [39],Wörtlich: Wer kippt die Krüge des Himmels um.
18,40,13,0,0, [40],Wörtlich: binde ihr Gesicht im Verborgenen.
18,40,15,0,0, [41],"Ein Riesentier, möglicherweise einem Nilpferd ähnlich."
18,40,25,0,0, [42],"Ein Riesentier, dem Krokodil ähnlich."
18,41,4,0,0, [43],"Vgl. die Anmerkung zu Kapitel <a href='B:220 40:25'>40,25</a>."
19,2,2,0,0, [1],Das hebräische Wort heißt »Messias« (= der gesalbte König). Vgl. »salben/Salbung« in den Sacherklärungen.
19,2,7,0,0, [2],Wörtlich: heute habe ich dich gezeugt. – Dies ist ein bildlicher Ausdruck für die Einsetzung des Königs in sein Amt.
19,2,12,0,0, [3],Wörtlich: Küsst den Sohn!
19,3,3,0,0, [4],"Im hebräischen Text steht hier und an vielen weiteren Stellen in den Psalmen noch das Wort »Sela«. Vermutlich handelt es sich dabei um eine musikalische Anweisung, die genaue Bedeutung ist jedoch unsicher. Man könnte zum Beispiel an ein Lauterwerden der Instrumente oder an ein musikalisches Zwischenspiel denken."
19,4,1,0,0, [5],"Im Hebräischen steht hier sowie zu Beginn vieler anderer Psalmen noch ein Wort, das nicht sicher zu übersetzen ist. Möglicherweise richtet es sich an den Chorleiter am Heiligtum oder beinhaltet eine musikalische Anweisung, wie das folgende Lied auf den Instrumenten begleitet werden soll."
19,4,5,0,0, [6],Oder: Erbebt vor Gott in Ehrfurcht.
19,5,4,0,0, [7],Oder: bereite ich ein Opfer für dich vor.
19,6,1,0,0, [8],"Oder: achtsaitigen. – Das hebräische Wort ist nicht sicher zu deuten. So auch in <a href='B:230 12:1'>Psalm  12,1</a>."
19,7,1,0,0, [9],"Die Bedeutung des hebräischen Wortes ist unsicher. Vielleicht handelt es sich dabei um eine musikalische Anweisung, wie der Psalm gesungen werden soll."
19,7,13,0,0, [10],Oder: Schon wieder schärft mein Feind sein Schwert.
19,8,1,0,0, [11],"Gemeint ist ein unbekanntes Musikinstrument oder eine Melodie (so auch in <a href='B:230 81:1'>Psalm  81,1</a>; <a href='B:230 84:1'>84,1</a>)."
19,8,3,0,0, [12],So nach der griechischen Übersetzung. Der hebräische Text lautet: hast du dir Macht bereitet.
19,8,5,0,0, [13],"Wörtlich: und was ist der Menschensohn, dass du dich um ihn kümmerst? – Vgl. »Menschensohn« in den Sacherklärungen."
19,8,6,0,0, [14],Oder: als Gott.
19,9,1,0,0, [15],"Die Psalmen 9, 10, 25, 34, 37, 111, 112, 119, 145sind alphabetisch angeordnet: Im Hebräischen fängt jeder Vers oder Abschnitt mit dem jeweils nächsten Buchstaben des Alphabets an."
19,9,17,0,0, [16],"Im Hebräischen folgt noch ein Wort, das möglicherweise so etwas wie »Zwischenspiel« bedeutet."
19,12,6,0,0, [17],"Oder: Ich werde ihnen die Hilfe schaffen, nach der sie sich sehnen."
19,12,7,0,0, [18],"Wörtlich: wie reines Silber, im Tiegel siebenmal geläutert."
19,12,8,0,0, [19],"Oder: Du, HERR, wirst deine Zusagen erfüllen."
19,14,6,0,0, [20],"Oder: Ihr wolltet die Pläne der Wehrlosen durchkreuzen, aber der HERR beschützt sie."
19,15,1,0,0, [21],Wörtlich: dein Zelt.
19,16,1,0,0, [22],Das hebräische Wort »miktam« in den Überschriften der <a href='B:230 16:1'>Psalmen  16</a> und 56–60 ist nur schwer zu deuten und meint möglicherweise »Besinnungslied«.
19,16,3,0,0, [23],Der hebräische Text ist nicht sicher zu deuten.
19,16,6,0,0, [24],"Wörtlich: (Vers <a href='B:230 16:5'>5</a>) Der Herr ist mein Erbteil und mein Becher (= Geschick). Du sicherst mir mein Los. (Vers <a href='B:230 16:6'>6</a>) Die Messschnüre sind mir in einer lieblichen Gegend zugefallen, ja, mein Erbteil gefällt mir."
19,16,9,0,0, [25],Wörtlich: Auch mein Körper wird in Sicherheit ruhen.
19,17,13,0,0, [26],Wörtlich: Mit deinem Schwert.
19,17,14,0,0, [27],"Wörtlich: Dein Aufgespartes – du füllst ihren Bauch damit; sie sättigen ihre Kinder, und diese hinterlassen ihren Rest ihren Kindern. – Die Bedeutung des Verses ist unsicher."
19,18,14,0,0, [28],Im hebräischen Text steht hier noch einmal der letzte Teil von Vers <a href='B:230 18:13'>13</a>: Hagel und glühende Kohlen. – Vermutlich handelt es sich hierbei um einen Abschreibfehler.
19,18,28,0,0, [29],Oder: die sich selbst nicht helfen können.
19,19,14,0,0, [30],Oder: vor gewissenlosen Menschen.
19,20,7,0,0, [31],"Vgl. die Anmerkung zu <a href='B:230 2:2'>Psalm  2,2</a>."
19,20,10,0,0, [32],"Oder: HERR, hilf, du (himmlischer) König!"
19,21,7,0,0, [33],Oder: Du setzt ihn für immer zum Segen.
19,21,9,0,0, [34],Nach einer anderen Auslegung wird in den Versen <a href='B:230 21:9-13'>9-13</a> Gott angeredet.
19,22,15,0,0, [35],Wörtlich: zerschmilzt in meinem Inneren wie Wachs.
19,22,17,0,0, [36],So nach der griechischen Übersetzung. Der hebräische Text lautet: Meine Hände und Füße wie ein Löwe.
19,22,27,0,0, [37],"Hier ist wohl an eine fröhliche Opfermahlzeit gedacht, zu welcher der Psalmbeter aus Dankbarkeit auch die Armen einlädt. Vgl. »Opfer« in den Sacherklärungen."
19,22,31,0,0, [38],"Oder: Er wird Nachkommen haben, die ihm dienen."
19,23,4,0,0, [39],"Wörtlich: Dein Stock und dein Stab trösten mich. – Mit dem Stock wehrte der Hirte Raubtiere ab, mit dem langen Stab lenkte er die Schafe."
19,23,5,0,0, [40],Wörtlich: Du salbst mein Haupt mit Öl. – Eine Begrüßungszeremonie für willkommene Gäste. Vgl. »salben/Salbung« in den Sacherklärungen.
19,23,6,0,0, [41],Oder: in dein Haus darf ich zurückkehren.
19,24,4,0,0, [42],Oder: der kein falsches Spiel treibt.
19,24,6,0,0, [43],So nach der griechischen Übersetzung. Der hebräische Text lautet: (als wahre Nachkommen von) Jakob.
19,24,10,0,0, [44],Hebräisch: Jahwe Zebaoth. – Vgl. »Name Gottes« in den Sacherklärungen.
19,28,8,0,0, [45],"Vgl. die Anmerkung zu <a href='B:230 2:2'>Psalm  2,2</a>."
19,29,1,0,0, [46],Wörtlich: ihr Gottessöhne. – Vgl. »Gottessöhne« in den Sacherklärungen.
19,29,2,0,0, [47],Oder: werft euch vor ihm nieder in heiligem Schmuck!
19,29,6,0,0, [48],"Wörtlich: Sirjon. – Ein anderer Name für den Berg Hermon. Vgl. <a href='B:50 3:9'>5. Mose  3,9</a>."
19,29,9,0,0, [49],Oder: lässt die Hirschkühe kalben.
19,31,6,0,0, [50],Wörtlich: meinen Geist.
19,31,11,0,0, [51],Oder nach der griechischen Übersetzung: Meine Sorgen rauben mir alle Kraft und lähmen …
19,31,22,0,0, [52],"Oder: Du hast mir Zuflucht geschenkt in einer befestigten Stadt, dort habe ich …"
19,32,1,0,0, [53],"Das hebräische Wort »maskil« in den Überschriften der Psalmen 32, 42, 44, 45, 52–55, 74, 78, 88, 89, 142 bezeichnet Lieder, die Anstöße zum Nachdenken geben sollen."
19,34,1,0,0, [54],"Vgl. <a href='B:90 21:11-16'>1. Samuel  21,11-16</a>. Der dort genannte Achisch, König von Gat, trägt hier die Würdebezeichnung für Philisterkönige »Abimelech«, d.h. »Königsvater«."
19,34,9,0,0, [55],Wörtlich: Schmeckt und seht.
19,35,2,0,0, [56],Wörtlich: Ergreife den kleinen und den großen Schild.
19,36,3,0,0, [57],"Oder: Er bildet sich etwas darauf ein, Unrecht zu tun und andere zu hassen."
19,36,9,0,0, [58],"Wörtlich: Sie trinken sich satt am Fett deines Hauses, und du tränkst sie mit dem Strom deiner Wonnen."
19,37,26,0,0, [59],Oder: und auch seine Kinder wurden anderen zum Segen.
19,37,27,0,0, [60],Oder: für immer in diesem Land wohnen.
19,37,34,0,0, [61],Wörtlich: und bleibe auf seinem Weg.
19,37,37,0,0, [62],"Oder: Wer den Frieden liebt, der hat eine Zukunft."
19,39,1,0,0, [63],"Nach <a href='B:130 16:41'>1. Chronik  16,41</a> der Begründer einer Musikgruppe am Tempel zur Zeit von König David. Vgl. auch <a href='B:230 62:1'>Psalm  62,1</a>; <a href='B:230 77:1'>77,1</a>."
19,40,8,0,0, [64],Oder: Im Buch des Gesetzes ist von mir geschrieben.
19,42,1,0,0, [65],"Der dreimal auftretende Refrain (<em><a href='B:230 42:6'>Psalm  42,6</a></em>.<em>12</em>; <em><a href='B:230 43:5'>43,5</a></em>) lässt vermuten, dass die Psalmen <em>42</em> und <em>43</em> ursprünglich zusammengehörten."
19,44,5,0,0, [66],Oder: Gib doch den Befehl zu Israels Rettung!
19,45,7,0,0, [67],Hier wird der König als Stellvertreter Gottes auf Erden angesprochen.
19,45,9,0,0, [68],"Wörtlich: nach Myrrhe, Aloe und Kassia."
19,45,10,0,0, [69],Wörtlich: Königstöchter sind unter deinen Kostbarkeiten.
19,46,10,0,0, [70],Oder: Schilde.
19,47,10,0,0, [71],"Oder: als ein Volk, das sich zum Gott Abrahams bekennt."
19,47,10,0,0, [72],"Wörtlich: Denn Gott gehören die Schilde der Erde. – Vgl. <a href='B:230 84:10'>Psalm  84,10</a>; <a href='B:230 89:19'>89,19</a>."
19,48,3,0,0, [73],"Oder: Der Berg Zion, die Höhenzüge des Berges Zafon. – Der Zafon galt in der kanaanitischen Mythologie als heiliger Ort, an dem sich die Götter versammelten. Somit würde der Zion hier als der wahre »Götterberg« gepriesen werden."
19,48,8,0,0, [74],"Wörtlich: Tarsis-Schiffe. – So wurden große Handelsschiffe bezeichnet, die in der Lage waren, die weite Strecke bis nach Tarsis (im heutigen Spanien) zu segeln."
19,48,15,0,0, [75],So nach vielen hebräischen Handschriften und der griechischen Übersetzung. Der hebräische Text lautet: bis zum Tode wird er uns führen.
19,49,5,0,0, [76],Wörtlich: ich neige mein Ohr zu einem Spruch.
19,49,12,0,0, [77],"Oder nach der griechischen Übersetzung: (Vers <a href='B:230 49:12'>12</a>) Gräber sind auf ewig ihre Behausung, ihre Wohnung für alle Generationen, auch wenn sie ganze Länder besessen haben."
19,49,15,0,0, [78],Der hebräische Text ist nur schwer zu deuten.
19,51,2,0,0, [79],"Vgl. <a href='B:100 12:1-14'>2. Samuel  12,1-14</a>."
19,51,8,0,0, [80],"Wörtlich: Du willst Wahrheit im Innersten, und im Verborgenen wirst du mir Weisheit kundtun."
19,51,9,0,0, [81],Wörtlich: Entsündige mich mit Ysop. – Vgl. »Ysop« in den Sacherklärungen.
19,51,12,0,0, [82],"Wörtlich: gib mir einen neuen, gefestigten Geist."
19,52,2,0,0, [83],"Vgl. <a href='B:90 21:8'>1. Samuel  21,8</a>; <a href='B:90 22:9-10'>22,9-10</a>."
19,52,3,0,0, [84],Wörtlich: Gottes Güte (währt) den ganzen Tag.
19,53,1,0,0, [85],"Die Bedeutung des hebräischen Ausdrucks ist unsicher, vielleicht ist hier auch an ein bestimmtes Lied oder Musikinstrument zu denken. So auch in <a href='B:230 88:1'>Psalm  88,1</a>."
19,53,6,0,0, [86],Wörtlich: ohne dass ein Schrecken da sein wird.
19,54,2,0,0, [87],"Vgl. <a href='B:90 23:19'>1. Samuel  23,19</a>; <a href='B:90 26:1'>26,1</a>."
19,55,15,0,0, [88],Oder: als wir noch unsere Gedanken austauschen konnten.
19,56,1,0,0, [89],"Vgl. <a href='B:90 21:11-16'>1. Samuel  21,11-16</a>."
19,56,8,0,0, [90],Wörtlich: die Völker.
19,56,9,0,0, [91],Wörtlich: Sammle meine Tränen in deinem Schlauch (= Behälter für Flüssigkeiten).
19,57,1,0,0, [92],"Vgl. <a href='B:90 22:1'>1. Samuel  22,1</a>; <a href='B:90 24:1-4'>24,1-4</a>."
19,57,9,0,0, [93],"Wörtlich: Wach auf, meine Ehre (= Seele)!"
19,58,2,0,0, [94],Oder: Ihr Götter.
19,58,10,0,0, [95],"Wörtlich: Noch bevor eure (Koch-)Töpfe (das Feuer vom) Dornstrauch verspüren – ob er frisch ist oder ob er schon hell brennt –, er (Gott) wird ihn fortwirbeln. – Der hebräische Text ist nicht sicher zu deuten."
19,59,1,0,0, [96],"Vgl. <a href='B:90 19:11'>1. Samuel  19,11</a>."
19,59,10,0,0, [97],So nach einigen hebräischen Handschriften und der griechischen Übersetzung. Der hebräische Text lautet: seine Stärke.
19,59,14,0,0, [98],Wörtlich: in Jakob.
19,59,16,0,0, [99],"So nach der griechischen Übersetzung. Der hebräische Text lautet: und wenn sie nicht satt werden, bleiben sie über Nacht."
19,60,2,0,0, [100],"Vgl. <a href='B:100 8:1-14'>2. Samuel  8,1-14</a>; <a href='B:130 18:3-13'>1. Chronik  18,3-13</a>. – Der Psalm wurde wahrscheinlich vor Joabs Sieg über die Edomiter gedichtet."
19,60,5,0,0, [101],"Wörtlich: Du hast uns einen Wein zu trinken gegeben, der uns zum Taumeln brachte."
19,60,10,0,0, [102],"Wörtlich: Moab ist mein Waschbecken, auf Edom will ich meinen Schuh werfen. – Die Bedeutung dieser Bilder ist unsicher."
19,61,3,0,0, [103],Wörtlich: Vom Ende der Erde.
19,61,3,0,0, [104],"Wörtlich: Bring mich auf den Felsen, der mir zu hoch ist."
19,61,5,0,0, [105],Wörtlich: In deinem Zelt.
19,63,6,0,0, [106],"Wörtlich: Wie von Mark und Fett wird meine Seele gesättigt werden, und mit jubelnden Lippen wird mein Mund dich preisen."
19,63,10,0,0, [107],Wörtlich: in die Tiefen der Erde. – Vgl. »Totenreich/Totenwelt« in den Sacherklärungen.
19,64,7,0,0, [108],Wörtlich: Das Innere eines jeden und sein Herz ist unergründlich.
19,64,9,0,0, [109],"Wörtlich: Sie brachten ihn zum Straucheln, ihre Zunge kommt über sie."
19,65,2,0,0, [110],Oder: Dich betet man in der Stille an. – Der hebräische Text ist nicht sicher zu deuten.
19,65,4,0,0, [111],So nach einigen hebräischen Handschriften und der griechischen Übersetzung. Der hebräische Text lautet: mich.
19,66,12,0,0, [112],Wörtlich: wir sind durch Feuer und durch Wasser gegangen.
19,68,5,0,0, [113],Oder: der durch die Steppe reitet.
19,68,13,0,0, [114],"Wörtlich: Flügel der Taube, die mit Silber und deren Schwingen mit grünlichem Gold bedeckt sind. – Der hebräische Text ist nur schwer zu deuten."
19,68,15,0,0, [115],Wörtlich: da fiel Schnee auf den Zalmon.
19,68,18,0,0, [116],"Oder: Gott selbst ist unter ihnen, der Heilige in seiner Herrlichkeit."
19,68,19,0,0, [117],Wörtlich: Du hast von Menschen Gaben empfangen.
19,68,29,0,0, [118],"Oder: Es ist der Wille deines Gottes, dass du machtvoll auftrittst, (Volk) Israel!"
19,68,31,0,0, [119],"Wörtlich: Bedrohe das Tier im Schilf, die Schar der Stiere samt den Völkerkälbern! Zerstampfe, die an Silber Gefallen haben, zerstreue die Völker, die Kriege lieben!"
19,68,32,0,0, [120],Oder: und seine Hände zu Gott ausstrecken.
19,69,14,0,0, [121],"Oder: Sei mir gnädig zu der Zeit, die du bestimmst!"
19,71,7,0,0, [122],Wörtlich: Für viele bin ich wie ein Vorzeichen geworden.
19,72,1,0,0, [123],Oder: Für Salomo. – Vgl. Vers 20.
19,72,3,0,0, [124],Wörtlich: Mögen die Berge dem Volk Heil tragen und die Hügel Gerechtigkeit!
19,72,5,0,0, [125],So nach der griechischen Übersetzung. Der hebräische Text lautet: Sie werden dich (Gott) fürchten.
19,72,7,0,0, [126],"Wörtlich: herrschen, bis der Mond nicht mehr ist."
19,72,10,0,0, [127],Wahrscheinlich Südspanien.
19,72,10,0,0, [128],"Saba ist wahrscheinlich Südarabien, Seba vielleicht Nordost-Afrika."
19,72,16,0,0, [129],Wörtlich: Sie sollen hervorblühen aus der Stadt wie das Kraut der Erde.
19,72,17,0,0, [130],Wörtlich: vor der Sonne soll aufsprossen sein Name.
19,72,17,0,0, [131],"Oder: Mögen alle Völker Gott bitten, sie so zu segnen, wie er den König gesegnet hat."
19,73,10,0,0, [132],Wörtlich: Darum wendet sich sein Volk ihnen zu. Wasser in Fülle wird bei ihnen ausgetrunken.
19,73,26,0,0, [133],Wörtlich: so bist du der Fels meines Herzens und mein Erbteil für immer.
19,74,9,0,0, [134],Wörtlich: Zeichen für uns sehen wir nicht.
19,74,12,0,0, [135],So nach der griechischen Übersetzung. Der hebräische Text lautet: mein König.
19,74,14,0,0, [136],Wörtlich: dem Leviatan.
19,74,19,0,0, [137],Wörtlich: Gib das Leben deiner Taube nicht den Tieren preis.
19,75,6,0,0, [138],"Verse <a href='B:230 75:5'>5b</a>–6a wörtlich: Denen, die mich ablehnen, sage ich: Erhebt nicht das Horn! Erhebt nicht zur Höhe euer Horn!"
19,75,7,0,0, [139],Wörtlich: Denn weder vom Osten noch vom Westen noch von der Wüste (= vom Süden) kommt Erhöhung.
19,75,11,0,0, [140],Wörtlich: die Hörner der Treuen werden erhöht werden.
19,76,3,0,0, [141],"Wörtlich: In Salem. – Anstelle des vollen Namens wird hier der alte Name gewählt, um das Wort »Schalom« (Frieden) anklingen zu lassen."
19,76,5,0,0, [142],"So nach der griechischen Übersetzung. Der hebräische Text lautet: Du bist glanzvoller, mächtiger als die Berge der Beute."
19,76,11,0,0, [143],Wörtlich: auch noch mit dem Rest des Zornes wirst du dich gürten.
19,78,25,0,0, [144],Gemeint ist das Manna. Vgl. »Manna« in den Sacherklärungen.
19,78,49,0,0, [145],Oder: Unglücksboten.
19,80,2,0,0, [146],Wörtlich: der du Josef.
19,80,7,0,0, [147],Wörtlich: Du hast uns zum Zankapfel für unsere Nachbarn gemacht.
19,80,18,0,0, [148],Wörtlich: Menschensohn. – Vgl. »Menschensohn« in den Sacherklärungen.
19,81,1,0,0, [149],"Damit ist entweder ein unbekanntes Musikinstrument oder eine Melodie gemeint (so auch in <a href='B:230 8:1'>Psalm  8,1</a>; <a href='B:230 84:1'>84,1</a>)."
19,81,11,0,0, [150],"Wörtlich: Mache deinen Mund weit auf, und ich will ihn füllen."
19,82,1,0,0, [151],"Mit den Göttern sind hier vielleicht menschliche Richter gemeint. Vgl. <a href='B:230 58:2'>Psalm  58,2</a>."
19,83,9,0,0, [152],"Wörtlich: mit den Söhnen Lots. – Vgl. <a href='B:10 19:30-38'>1. Mose  19,30-38</a>."
19,84,1,0,0, [153],"Damit ist entweder ein unbekanntes Musikinstrument oder eine Melodie gemeint (so auch in <a href='B:230 8:1'>Psalm  8,1</a>; <a href='B:230 81:1'>81,1</a>)."
19,84,6,0,0, [154],Wörtlich: in deren Herzen gebahnte Wege sind.
19,84,7,0,0, [155],Wörtlich: durch das Baka-Tal gehen.
19,84,10,0,0, [156],"Wörtlich: Sieh her, o Gott, auf unseren Schild. – Vgl. <a href='B:230 47:10'>Psalm  47,10</a>; <a href='B:230 89:19'>89,19</a>."
19,84,10,0,0, [157],Wörtlich: Blicke auf das Antlitz deines Gesalbten!
19,87,4,0,0, [158],"Wörtlich: Ich will Rahab und Babel zu denen zählen, die mich kennen; siehe, Philistäa und Tyrus samt Kusch. Dieser ist dort geboren. – Vgl. »Rahab« in den Sacherklärungen."
19,87,5,0,0, [159],Wörtlich: Mann für Mann ist dort geboren.
19,87,6,0,0, [160],"Wörtlich: Der HERR wird schreiben beim Verzeichnen der Völker: Dieser ist dort geboren. – Vgl. <a href='B:290 56:5'>Jesaja  56,5</a>; <a href='B:330 13:9'>Hesekiel  13,9</a>."
19,89,6,0,0, [161],Wörtlich: die Schar deiner Heiligen.
19,89,7,0,0, [162],Wörtlich: Keiner von den Göttersöhnen. – Vgl. »Gottessöhne« in den Sacherklärungen.
19,89,11,0,0, [163],Wörtlich: Rahab. – Vgl. »Rahab« in den Sacherklärungen.
19,89,19,0,0, [164],Wörtlich: Dem HERRN gehört unser Schild und dem Heiligen Israels unser König.
19,89,25,0,0, [165],Wörtlich: und durch meinen Namen wird sein Horn erhöht werden. – Das Horn steht sinnbildlich für Stärke und Kraft.
19,92,11,0,0, [166],"Wörtlich: Du erhöhst mein Horn wie das eines Büffels, mit frischem Öl hast du mich überschüttet. – Das Horn steht sinnbildlich für Stärke und Kraft. Vgl. außerdem »salben/Salbung« in den Sacherklärungen."
19,95,8,0,0, [167],"Vers <a href='B:230 95:8'>8b</a> wörtlich: wie zu Meriba, wie am Tag von Massa in der Wüste. – Meriba bedeutet »Vorwurf«, Massa »Herausforderung«. Vgl. <a href='B:20 17:1-7'>2. Mose  17,1-7</a>."
19,96,9,0,0, [168],Oder: Werft euch vor ihm nieder in heiligem Schmuck!
19,99,4,0,0, [169],Wörtlich: in Jakob.
19,99,5,0,0, [170],Wörtlich: Fußschemel.
19,100,3,0,0, [171],Oder: wir haben nichts dazu getan.
19,102,24,0,0, [172],Wörtlich: Auf dem Weg.
19,103,4,0,0, [173],Wörtlich: und krönt dein Leben mit Liebe und Barmherzigkeit.
19,104,3,0,0, [174],"Wörtlich: in den Wassern. – Vgl. <a href='B:10 1:6-8'>1. Mose  1,6-8</a>."
19,104,18,0,0, [175],"Wörtlich: der Klippdachs. – Der Klippdachs war ein murmeltierähnlicher Pflanzenfresser von gelb-brauner Farbe. Vgl. <a href='B:30 11:5'>3. Mose  11,5</a>; <a href='B:50 14:7'>5. Mose  14,7</a>."
19,105,15,0,0, [176],Wörtlich: Rührt meine Gesalbten nicht an und tut meinen Propheten nichts Böses!
19,105,28,0,0, [177],Oder nach der griechischen Übersetzung: doch sie (die Ägypter) widersetzten sich seinem Befehl.
19,105,40,0,0, [178],Gemeint ist das Manna. Vgl. »Manna« in den Sacherklärungen.
19,108,2,0,0, [179],"Wörtlich: (Wach) auf, meine Ehre (= Seele)!"
19,108,10,0,0, [180],"Wörtlich: Moab ist mein Waschbecken, auf Edom will ich meinen Schuh werfen. – Die Bedeutung dieser Bilder ist unsicher."
19,109,6,0,0, [181],Möglicherweise zitiert der Beter in den Versen <a href='B:230 109:6-19'>6-19</a> die Verwünschungen seiner Gegner. Dann müsste der Abschnitt eingeleitet werden mit: »Sie sagen: Ein Ankläger soll gegen ihn auftreten.«
19,110,3,0,0, [182],Wörtlich: (Vers <a href='B:230 110:3'>3</a>) Dein Volk ist willig am Tag deiner Macht. Aus dem Schoß der Morgenröte kommt dir der Tau deiner Kindschaft. – Der hebräische Text ist nicht sicher zu deuten.
19,110,6,0,0, [183],So nach der griechischen Übersetzung. Der hebräische Text lautet: Das Haupt über ein großes Land wird er vernichten.
